{
  "schemaVersion": 1,
  "providers": [
    { "id": "claude", "enabled": true },
    { "id": "codex", "enabled": true },
    { "id": "grok", "enabled": false },
    { "id": "antigravity", "enabled": false }
  ],
  "display": {
    "metric": "remaining"
  },
  "refreshIntervalSeconds": 60,
  "notifications": {
    "enabled": true
  }
}
