{
  "schemaVersion": 1,
  "providers": [
    { "id": "claude", "enabled": false },
    { "id": "codex", "enabled": true },
    { "id": "grok", "enabled": true },
    { "id": "antigravity", "enabled": false }
  ],
  "display": {
    "metric": "used"
  },
  "refreshIntervalSeconds": 30,
  "notifications": {
    "enabled": false
  }
}
